{
  "schema_version": "outcome-contract-v1",
  "project": {
    "project_id": "pilot-estate-01",
    "name": "the pilot estate",
    "repository": {
      "name": "pilot-estate",
      "branch": "main",
      "remote": "origin"
    },
    "provenance": {
      "project_id": "manifest",
      "name": "manifest",
      "repository": "git"
    }
  },
  "language": "en",
  "question": "Can the intake screen capture a national beverage bottler's project record before planning starts?",
  "success_checks": [],
  "must_answer": [],
  "affected_products": [
    "brother"
  ],
  "ticket": null,
  "audit": {
    "required": false,
    "manifest": null
  },
  "persona": "lead",
  "state": "draft",
  "receipts": [
    {
      "id": "r-1",
      "path": "docs/plan/receipts/r-1.json",
      "verdict": "PASS",
      "ref": "evidence:r-1.json"
    }
  ],
  "questions": [
    {
      "field": "success_checks",
      "question": "how do you check this repository"
    }
  ],
  "history": [
    {
      "at": "2026-09-08T09:00:00Z",
      "by": "ask",
      "note": "record opened"
    }
  ],
  "decision": null
}
